{"body_reads_in_evidence":"0","coverage_scope":"fixture-only","cutover_eligible":false,"evidence_version":"second-brain-unified-db-export-conformance-v1","import_invoked":false,"live_export_authorized":false,"native_identity_leaked":false,"plaintext_leaked":false,"serving_promotion":false,"source_mutation":false,"source_unchanged":true,"state":"FIXTURE_EXPORTED_NOT_AUTHORIZED"}
